cluster_id,canonical_title,min_price,all_titles,all_prices,num_listings,cluster_confidence,category
38,"Electra A 1.0 כ""ס מזגן עילי 140 אינצ' בצבע לבן",1105.0,"‏מזגן עילי Electra A Inverter 140  ‏1.0 ‏כ""ס ||| השוואה ב-30 חנויות ||| השוואת מחירים ||| מזגן עילי 140 1.0 כ""ס Electra A משלוח חינם ||| Electra A 1.0 כ""ס מזגן עילי 140 אינצ' בצבע לבן ||| Inverter 140 ‏1.0 ‏כ""ס ‏מזגן עילי Electra A","1105.0, 1109.0, 1278.0, 1391.0",6,0.98,מזגנים
37,"מזגן עילי Inverter Electra Magic Touch 1.0 כ""ס בצבע לבן",1210.0,"‏מזגן עילי Electra Magic Touch Inverter 140  ‏1.0 ‏כ""ס ||| השוואה ב-26 חנויות ||| השוואת מחירים ||| מזגן עילי 1.0 כ""ס בוש Magic Touch Inverter יבואן רשמי ||| מזגן עילי Inverter Electra Magic Touch 1.0 כ""ס בצבע לבן ||| Touch Inverter 140 ‏1.0 ‏כ""ס ‏מזגן עילי Electra Magic","1210.0, 1328.0, 1389.0, 1677.0",6,0.98,מזגנים
58,מזגן עילי Tadiran Supreme Inverter 180NG Carbon אפורר קרבון יבואן רשמי,2208.0,מזגן עילי Tadiran Supreme Inverter 180NG Carbon אפורר קרבון יבואן רשמי ||| קנו עכשיו ||| מזגן עילי טדירן Supreme Inverter 180NG Carbon בצבע שחור יבואן רשמי ||| יבואן רשמי מזגן עילי Carbon 180NG Supreme Inverter טדירן ||| 180NG Carbon אפורר קרבון יבואן רשמי מזגן עילי Tadiran Supreme Inverter,"2208.0, 2464.0, 2477.0, 2680.0",5,0.98,מזגנים
60,"‏מזגן עילי Tadiran Solo Inverter 240 NG  ‏2.0 ‏כ""ס",2810.0,"‏מזגן עילי Tadiran Solo Inverter 240 NG  ‏2.0 ‏כ""ס ||| השוואה ב-29 חנויות ||| השוואת מחירים ||| Inverter 240 NG ‏2.0 ‏כ""ס ‏מזגן עילי Tadiran Solo","2810.0, 3220.0",4,0.98,מזגנים
39,"Electra A 2.5 כ""ס מזגן עילי Inverter 340 בצבע שחור",2835.0,"‏מזגן עילי Electra A Inverter 340  ‏2.5 ‏כ""ס ||| השוואה ב-31 חנויות ||| השוואת מחירים ||| מזגן עילי 340 2.5 כ""ס בוש A Inverter יבואן רשמי ||| Electra A 2.5 כ""ס מזגן עילי Inverter 340 בצבע שחור ||| Inverter 340 ‏2.5 ‏כ""ס ‏מזגן עילי Electra A","2835.0, 3246.0, 3346.0, 3506.0",6,0.98,מזגנים
51,‏מזגן עילי INV 30X EU שנת 2023 Saga יבואן רשמי,3321.0,‏מזגן עילי INV 30X EU שנת 2023 Saga יבואן רשמי ||| קנו עכשיו ||| מזגן עילי Saga 30X EU 2023 יבואן רשמי ||| 2023 מזגן עילי יבואן רשמי Saga EU 30X ||| שנת 2023 Saga יבואן רשמי ‏מזגן עילי INV 30X EU,"3321.0, 3610.0, 3625.0, 3975.0",5,0.98,מזגנים
61,"‏מזגן עילי Tadiran Solo Inverter 340 NG  ‏2.5 ‏כ""ס",3540.0,"‏מזגן עילי Tadiran Solo Inverter 340 NG  ‏2.5 ‏כ""ס ||| השוואה ב-31 חנויות ||| השוואת מחירים ||| Inverter 340 NG ‏2.5 ‏כ""ס ‏מזגן עילי Tadiran Solo","3540.0, 3580.0",4,0.98,מזגנים
41,"‏מזגן עילי Tadiran Solo Inverter 370 NG  ‏3.5 ‏כ""ס",4290.0,"‏מזגן עילי Tadiran Solo Inverter 370 NG  ‏3.5 ‏כ""ס ||| השוואה ב-32 חנויות ||| השוואת מחירים ||| מזגן עילי בוש Solo Inverter 3.5 כ""ס ||| יבואן רשמי מזגן עילי Tadiran 370 NG 3.5 HP ||| Inverter 370 NG ‏3.5 ‏כ""ס ‏מזגן עילי Tadiran Solo","4290.0, 4601.0, 4748.0, 5123.0",6,0.98,מזגנים
18,"Beko מייבש כביסה DV8121 8 ק""ג - משלוח חינם",1106.0,"מייבש כביסה Beko DV8121  ‏8 ‏ק""ג ||| השוואה ב-17 חנויות ||| השוואת מחירים ||| Beko מייבש כביסה DV8121 8 ק""ג - משלוח חינם ||| מייבש Beko DV8121 8 ק""ג - יבואן רשמי ||| DV8121 ‏8 ‏ק""ג מייבש כביסה Beko ||| מייבש כביסה Beko   ‏8 ‏ק""ג","1106.0, 1183.0, 1186.0, 1304.0, 1409.0",7,0.98,מייבשי כביסה
19,"מייבש כביסה Midea 8 ק""ג MDG80-C05/B09E - יבואן רשמי",1235.0,"מייבש כביסה Midea MDG80-C05/B09E 6429  ‏8 ‏ק""ג ||| השוואה ב-17 חנויות ||| השוואת מחירים ||| Midea מייבש כביסה MDG80-C05/B09E 8 ק""ג - צבע כסוף ||| מייבש כביסה Midea 8 ק""ג MDG80-C05/B09E - יבואן רשמי ||| MDG80-C05/B09E 6429 ‏8 ‏ק""ג מייבש כביסה Midea ||| מייבש כביסה Midea -C05/B09E 6429  ‏8 ‏ק""ג","1235.0, 1237.0, 1344.0, 1346.0, 1533.0",7,0.98,מייבשי כביסה
11,"מייבש כביסה Zanussi ZDCB284W 8 ק""ג - יבואן רשמי",1828.0,"מייבש כביסה Zanussi ZDCB284W  ‏8 ‏ק""ג ||| קנו עכשיו ||| מייבש כביסה Zanussi ZDCB284W  ‏8 ‏ק""ג ||| השוואה ב-26 חנויות ||| השוואת מחירים ||| מייבש כביסה Zanussi ZDCB284W 8 ק""ג - יבואן רשמי ||| Zanussi 8 ק""ג ZDCB284W מייבש כביסה - משלוח חינם ||| ZDCB284W ‏8 ‏ק""ג מייבש כביסה Zanussi ||| מייבש כביסה Zanussi   ‏8 ‏ק""ג","1828.0, 1940.0, 2122.0, 2154.0, 2162.0",9,0.98,מייבשי כביסה
1,מייבש כביסה פתח חזית HeatPump קונדנסור 9 ק''ג Samsung SmartThings DV90DG52A0AE - צבע לבן דלת שחורה,2608.0,"מייבש כביסה Samsung DV90DG52A0AE  ‏9 ‏ק""ג ||| השוואה ב-28 חנויות ||| השוואת מחירים ||| Samsung DV90DG52A0AE – מייבש כביסה 9 ק''ג בטכנולוגיית Heatpump | יבואן רשמי ||| קנו עכשיו ||| מייבש כביסה Samsung DV90DG52A0AE ‏9 ‏קג סמסונג ||| Samsung DV90DG52A0AE – מייבש כביסה 9 ק''ג בטכנולוגיית Heatpump ||| מייבש כביסה Samsung DV90DG52A0AE ‏9 ‏ק""ג סמסונג ||| מייבש כביסה קונדנסור 9 ק''ג כולל משאבת חום Samsung DV90DG52A0AE | סמסונג ||| מייבש כביסה קונדנסור 9 ק''ג כולל משאבת חום Samsung סמסונג DV90DG52A0AE *ניופרו היבואן הרשמי* ||| מייבש כביסה קונדנסור - Samsung DV90DG52A0AE ||| מייבש כביסה 9 ק''ג קונדנסור Samsung DV90DG52A0AE ||| מייבש כביסה Samsung DV90DG52A0AE ‏9 ‏ק''ג יבואן רשמי ||| מייבש כביסה 9 ק''ג Samsung DV90DG52A0AE משאבת חום - סמסונג ישראל היבואן הרישמי ||| מייבש כביסה קונדנסור - 9 ק""ג כולל משאבת חום Samsung סמסונג DV90DG52A0AE ||| מייבש כביסה Samsung DV90DG52A0AE יבואן רשמי ||| מייבש כביסה 9 ק""ג SAMSUNG סמסונג דגם DV90DG52A0AE ||| מייבש כביסה משאבת חום 9 ק""ג סמסונג דגם DV90DG52A0AE ||| מייבש כביסה משאבת חום 9 קילו סמסונג SAMSUNG DV90DG52A0AE ||| מייבש כביסה Samsung DV90DG52A0AE ‏9 ‏ק''ג סמסונג ||| מייבש כביסה פתח חזית HeatPump קונדנסור 9 ק''ג Samsung SmartThings DV90DG52A0AE - צבע לבן דלת שחורה ||| מייבש כביסה קונדנסור - 9 ק""ג כולל משאבת חום Samsung DV90DG52A0AE סמסונג - Samsung Samsung ||| מייבש כביסה משאבת חום 9 ק''ג סמסונג דגם Samsung DV90DG52A0AE ניופרו ||| מייבש כביסה SAMSUNG DV90DG52A0AE ||| DV90DG52A0AE מייבש כביסה 9 ק""ג בטכנולוגי ||| מייבש כביסה Samsung DV90DG52A0AE 9 ק""ג - יבואן רשמי ||| מייבש כביסה בוש DV90DG52A0AE 9 ק""ג - משלוח חינם ||| DV90DG52A0AE ‏9 ‏ק""ג מייבש כביסה Samsung ||| מייבש כביסה Samsung   ‏9 ‏ק""ג","2608.0, 2749.0, 2891.0, 3019.0, 3110.0",29,0.98,מייבשי כביסה
34,"Siemens מייבש כביסה משאבת חום 9 ק""ג סימנס דגם WQ41G29IL",4446.0,"Siemens מייבש כביסה משאבת חום 9 ק""ג סימנס דגם WQ41G29IL ||| קנו עכשיו ||| מייבש כביסה סימנס 9 ק""ג WQ41G29IL משאבת חום ||| Siemens מייבש כביסה 9 ק""ג דגם WQ41G29IL ||| 9 ק""ג סימנס דגם WQ41G29IL Siemens מייבש כביסה משאבת חום ||| Siemens מייבש כביסה משאבת חום 9 ק""ג סימנס דגם","4446.0, 4566.0, 4590.0, 4691.0, 5397.0",6,0.98,מייבשי כביסה
15,אספרסו מכונת Nespresso Inissia EN 80 - יבואן רשמי,297.0,‏מכונת אספרסו Nespresso Inissia EN 80 ||| השוואה ב-16 חנויות ||| השוואת מחירים ||| ‏מכונת אספרסו Nespresso Inissia EN 80 נספרסו ||| קנו עכשיו ||| מכונת אספרסו Nespresso EN 80 - משלוח חינם ||| אספרסו מכונת Nespresso Inissia EN 80 - יבואן רשמי ||| Inissia EN 80 ‏מכונת אספרסו Nespresso,"297.0, 332.0, 343.0, 423.0",8,0.98,מכונות קפה
48,מכונת קפה Essenza Mini EN85L נספרסו Nespresso צבע ליים,345.0,מכונת קפה Essenza Mini EN85L נספרסו Nespresso צבע ליים ||| קנו ב-zapstore ||| קנו עכשיו ||| EN85L נספרסו Nespresso צבע ליים מכונת קפה Essenza Mini ||| מכונת קפה Essenza Mini  נספרסו Nespresso צבע ליים,"345.0, 358.0, 359.0",5,0.98,מכונות קפה
21,מכונת אספרסו Gaggia EG2109 - יבואן רשמי,718.0,‏מכונת אספרסו Gaggia EG2109 ||| השוואה ב-16 חנויות ||| השוואת מחירים ||| מכונת אספרסו Gaggia EG2109 - יבואן רשמי ||| Gaggia EG2109 מכונת אספרסו - משלוח חינם ||| Gaggia EG2109 ‏מכונת אספרסו ||| ‏מכונת אספרסו Gaggia,"718.0, 789.0, 868.0, 938.0",7,0.98,מכונות קפה
4,מכונת קפה כולל מקציף מובנה NESPRESSO Lattissima One F121-WH נספרסו - NESPRESSO נספרסו,734.0,‏מכונת אספרסו Nespresso Lattissima One EN510 ||| השוואה ב-13 חנויות ||| השוואת מחירים ||| מכונת קפה נספרסו לטיסימה וואן NESPRESSO Lattissima One ||| מכונת קפה NESPRESSO lattissima ONE ||| מכונת אספרסו Nespresso Lattissima One יבואן רשמי ||| מכונת קפה NESPRESSO LATTISSIMA ONE נספרסו דגם F121 ||| מכונת אספרסו Nespresso Lattissima One נספרסו ||| מכונת קפה עם מקציף מובנה צבע לבן Nespresso Lattissima One ||| מכונת קפה נספרסו Nespresso Delonghi Lattissima One EN501 כולל מקציף חלב מובנה ||| מכונת קפה נספרסו LATTISSIMA ONE לבן VIP ||| ‏מכונת אספרסו Nespresso Lattissima One נספרסו ||| מכונת אספרסו לטיסימה נספרסו Nespresso Lattissima One Delonghi ||| מכונת קפה כולל מקציף מובנה NESPRESSO Lattissima One F121-WH נספרסו - NESPRESSO נספרסו ||| מכונת אספרסו Lattissima One EN510 Nespresso עם משלוח חינם ||| Nespresso EN510 מכונת אספרסו Lattissima One ||| Lattissima One EN510 ‏מכונת אספרסו Nespresso ||| ‏מכונת אספרסו Nespresso Lattissima One,"734.0, 810.0, 853.0, 882.0, 1005.0",18,0.98,מכונות קפה
7,מכונת קפה נספרסו עם מקציף Nespresso Citiz and Milk EN267 לבן,776.0,‏מכונת אספרסו Nespresso Citiz&Milk EN267 ||| השוואה ב-12 חנויות ||| השוואת מחירים ||| מכונת קפה Nespresso נספרסו +מקציף Citiz&Milk EN267 שחור ||| קנו עכשיו ||| השוואת מחירים מכונות קפה‏ ||| ‏מכונת אספרסו Nespresso Citiz&Milk EN267 נספרסו ||| מכונת קפה Nespresso נספרסו +‎מקציף Citiz&Milk EN267 שחור ||| מכונת קפה Nespresso נספרסו +‎מקציף Citiz&Milk EN267 ||| מכונת קפה כולל מקציף חלב CITIZ&MILK NESPRESSO - צבע שחור ||| מכונת קפה נספרסו עם מקציף Nespresso Citiz and Milk EN267 לבן ||| Nespresso מכונת אספרסו Citiz&Milk EN267 - יבואן רשמי ||| מכונת אספרסו EN267 של Nespresso עם חלב ||| Nespresso Citiz&Milk EN267 ‏מכונת אספרסו ||| ‏מכונת אספרסו Nespresso Citiz&Milk,"776.0, 782.0, 899.0, 919.0, 968.0",15,0.98,מכונות קפה
20,מכונת אספרסו Smeg ECF02 - יבואן רשמי,1420.0,‏מכונת אספרסו Smeg ECF02 ||| השוואה ב-16 חנויות ||| השוואת מחירים ||| מכונת אספרסו Smeg ECF02 - יבואן רשמי ||| Smeg ECF02 מכונת אספרסו - משלוח חינם ||| Smeg ECF02 ‏מכונת אספרסו ||| ‏מכונת אספרסו Smeg,"1420.0, 1592.0, 1649.0, 1805.0, 1848.0",7,0.98,מכונות קפה
26,Nespresso מכונת קפה NESPRESSO CREATISTA PLUS נספרסו דגם J520-IL-ME-NE פלוס,1531.0,Nespresso מכונת קפה NESPRESSO CREATISTA PLUS נספרסו דגם J520-IL-ME-NE פלוס ||| קנו עכשיו ||| NESPRESSO מכונת קפה CREATISTA PLUS דגם J520-IL-ME-NE עם משלוח חינם ||| נספרסו מכונת קפה J520-IL-ME-NE CREATISTA PLUS ||| PLUS נספרסו דגם J520-IL-ME-NE פלוס Nespresso מכונת קפה NESPRESSO CREATISTA ||| Nespresso מכונת קפה   PLUS נספרסו דגם J520-IL-ME-NE פלוס,"1531.0, 1654.0, 1789.0, 1836.0, 2074.0",6,0.98,מכונות קפה
3,מכונת אספרסו אוטומטית 1450 וואט תוצרת DELONGI דגם ECAM 350.15.B,1642.0,‏מכונת אספרסו Delonghi ECAM350.15.B ||| השוואה ב-16 חנויות ||| השוואת מחירים ||| מכונת קפה דלונגי DINAMICA ECAM 350.15.B דלונגי Delonghi ||| מכונת אספרסו אוטומטית 1450 וואט תוצרת DELONGI דגם ECAM 350.15.B ||| מכונת אספרסו Delonghi ECAM350.15.B דה לונגי ||| מכונת אספרסו Delonghi ECAM350.15.B ||| מכונת אספרסו אוטומטית Delonghi דלונגי Dinamica ECAM350.15.B ||| מכונת קפה אוטומטית דלונגי DeLonghi ECAM350.15.B ||| מכונת אספרסו DELONGHI ECAM 350.15.B ||| מכונת קפה טוחנת דלונגי דגם ECAM350.15.B שחור ||| מכונת אספרסו אוטומטית מבית DELONGHI דלונגי דגם ECAM350.15.B ||| ‏מכונת אספרסו Delonghi ECAM350.15.B דה לונגי ||| ‏מכונת קפה אספרסו דה לונגי Delonghi ECAM350.15.B ||| מכונת קפה אוטומטית Delonghi ECAM350.15.B ||| Delonghi מכונת אספרסו ECAM350.15.B - יבואן רשמי ||| מכונת אספרסו ECAM350.15.B Delonghi - משלוח חינם ||| Delonghi ECAM350.15.B ‏מכונת אספרסו ||| ‏מכונת אספרסו Delonghi .15.B,"1642.0, 1785.0, 1829.0, 1977.0, 2031.0",19,0.98,מכונות קפה
22,‏מכונת אספרסו Delonghi Magnifica Start ECAM220.60.B,1948.0,‏מכונת אספרסו Delonghi Magnifica Start ECAM220.60.B ||| השוואה ב-16 חנויות ||| השוואת מחירים ||| מכונת אספרסו דלונגי Magnifica Start ECAM220.60.B ||| אספרסו דלונגי ECAM220.60.B ||| Magnifica Start ECAM220.60.B ‏מכונת אספרסו Delonghi ||| ‏מכונת אספרסו Delonghi Magnifica Start .60.B,"1948.0, 2206.0, 2290.0, 2355.0, 2364.0",7,0.98,מכונות קפה
10,Breville BES875BSS מכונת אספרסו - משלוח חינם,2075.0,‏מכונת אספרסו Breville BES875BSS ||| השוואה ב-17 חנויות ||| השוואת מחירים ||| ‏מכונת אספרסו Breville BES875BSS ברוויל ||| קנו עכשיו ||| Breville BES875BSS מכונת אספרסו - משלוח חינם ||| מכונת אספרסו Breville BES875BSS עם ג'וג חלב ||| Breville BES875BSS ‏מכונת אספרסו ||| ‏מכונת אספרסו Breville,"2075.0, 2393.0, 2470.0, 2971.0, 2989.0",9,0.98,מכונות קפה
33,Espresso Machine EC 9355.M דלונגי Specialista Prestigio - משלוח חינם,2764.0,‏מכונת אספרסו Delonghi Specialista Prestigio EC 9355.M ||| השוואה ב-17 חנויות ||| השוואת מחירים ||| מכונת אספרסו דלונגי Specialista Prestigio EC 9355.M - יבואן רשמי ||| Espresso Machine EC 9355.M דלונגי Specialista Prestigio - משלוח חינם ||| Specialista Prestigio EC 9355.M ‏מכונת אספרסו Delonghi,"2764.0, 2843.0, 3218.0, 3271.0",6,0.98,מכונות קפה
55,‏מכונת אספרסו Delonghi Rivelia EXAM440.55,3105.0,‏מכונת אספרסו Delonghi Rivelia EXAM440.55 ||| השוואה ב-19 חנויות ||| השוואת מחירים ||| Delonghi Rivelia EXAM440.55 ‏מכונת אספרסו ||| ‏מכונת אספרסו Delonghi Rivelia .55,"3105.0, 3498.0, 3515.0",5,0.98,מכונות קפה
17,"מסך מחשב 24 אינץ Full HD IPS עם 120Hz, 1ms MPRT, רמקולים מובנים והגנת עיניים Philips 24E1N1100A",303.0,"מסך מחשב  ‏24 ‏אינטש Philips 24E1N1100A 36208-240-23 Full HD ||| השוואה ב-30 חנויות ||| השוואת מחירים ||| מסך מחשב 24 אינץ Full HD IPS עם 120Hz, 1ms MPRT, רמקולים מובנים והגנת עיניים Philips 24E1N1100A ||| קנו עכשיו ||| מסך מחשב Philips 24 אינטש 24E1N1100A - Full HD - דגם 36208-240-23 ||| Philips 24 אינטש 24E1N1100A - מסך מחשב Full HD ||| Philips 24E1N1100A 36208-240-23 Full HD מסך מחשב ‏24 ‏אינטש","303.0, 316.0, 334.0, 372.0",8,0.98,מסכי מחשב
40,"מסך מחשב  ‏27 ‏אינטש Xiaomi Monitor A27i IPS 27"" 81067 Full HD",409.0,"מסך מחשב  ‏27 ‏אינטש Xiaomi Monitor A27i IPS 27"" 81067 Full HD ||| השוואה ב-16 חנויות ||| השוואת מחירים ||| Xiaomi Monitor 27 אינטש A27i IPS 27"" Full HD מסך מחשב ||| מסך מחשב 27 אינטש Xiaomi A27i Full HD ||| A27i IPS 27"" 81067 Full HD מסך מחשב ‏27 ‏אינטש Xiaomi Monitor","409.0, 445.0, 480.0, 573.0",6,0.98,מסכי מחשב
44,מסך מחשב Samsung Essential S3 S27D362GAM Full HD,462.0,מסך מחשב Samsung Essential S3 S27D362GAM Full HD ||| השוואה ב-17 חנויות ||| השוואת מחירים ||| Samsung Essential S3 מסך מחשב S27D362GAM Full HD ||| מסך מחשב Samsung Full HD S27D362GAM Essential S3 ||| S3 S27D362GAM Full HD מסך מחשב Samsung Essential,"462.0, 488.0, 497.0, 534.0",6,0.98,מסכי מחשב
42,מסך מחשב LG UltraGear 24GS50F-B איכות גבוהה,495.0,מסך מחשב LG UltraGear24GS50F-B Full HD ||| השוואה ב-17 חנויות ||| השוואת מחירים ||| מסך מחשב LG UltraGear 24GS50F-B Full HD ||| מסך מחשב LG UltraGear 24GS50F-B איכות גבוהה ||| UltraGear24GS50F-B Full HD מסך מחשב LG,"495.0, 573.0, 617.0, 702.0",6,0.98,מסכי מחשב
47,Samsung C27F391FHR מסך מחשב Full HD - משלוח חינם,547.0,מסך מחשב Samsung C27F391FHR Full HD ||| השוואה ב-17 חנויות ||| השוואת מחירים ||| Samsung C27F391FHR מסך מחשב Full HD - משלוח חינם ||| מסך מחשב Full HD Samsung C27F391FHR - צבע שחור ||| C27F391FHR Full HD מסך מחשב Samsung,"547.0, 574.0, 628.0, 633.0",6,0.98,מסכי מחשב
43,מסך מחשב  ‏27 ‏אינטש AOC GAM C27G4ZXE Full HD,700.0,מסך מחשב  ‏27 ‏אינטש AOC GAM C27G4ZXE Full HD ||| השוואה ב-19 חנויות ||| השוואת מחירים ||| מסך מחשב AOC GAM C27G4ZXE 27 אינטש Full HD ||| AOC GAM מסך מחשב 27 אינטש Full HD C27G4ZXE ||| AOC GAM C27G4ZXE Full HD מסך מחשב ‏27 ‏אינטש,"700.0, 719.0, 733.0, 803.0",6,0.98,מסכי מחשב
45,מסך מחשב G3 Odyssey Samsung S27DG302EM איכות גבוהה,823.0,מסך מחשב Samsung Odyssey G3 S27DG302EM Full HD ||| השוואה ב-17 חנויות ||| השוואת מחירים ||| Samsung Odyssey G3 מסך מחשב S27DG302EM Full HD ||| מסך מחשב G3 Odyssey Samsung S27DG302EM איכות גבוהה ||| G3 S27DG302EM Full HD מסך מחשב Samsung Odyssey,"823.0, 849.0, 942.0, 960.0",6,0.98,מסכי מחשב
5,מסך מחשב גיימינג קעור 34'' Xiaomi WQHD שיאומי Curved Gaming Monitor G34WQi,956.0,"מסך מחשב Xiaomi Curved Gaming Monitor G34WQi UWQHD ||| קנו ב-zapstore ||| מסך מחשב Xiaomi Curved Gaming Monitor G34WQi UWQHD ||| השוואה ב-19 חנויות ||| השוואת מחירים ||| קנו עכשיו ||| מסך מחשב Xiaomi Curved Gaming Monitor G34WQi UWQHD יבואן רשמי !!! ||| מסך מחשב גיימינג קעור ''Xiaomi G34WQi WQHD 34 ||| מסך מחשב גיימינג קעור ''34 שיאומי Xiaomi Curved Gaming Monitor G34WQi ||| מסך מחשב גיימינג קעור 34'' Xiaomi WQHD שיאומי Curved Gaming Monitor G34WQi ||| Xiaomi G34WQi מסך מחשב גיימינג קעור 34 אינץ' שנתיים אחריות יבואן רשמי ||| מסך מחשב Xiaomi Curved Gaming Monitor G34WQi UWQHD שיאומי ||| Xiaomi Curved Gaming Monitor G34WQi UWQHD ||| Xiaomi - שיאומי Xiaomi - שיאומי מסך מחשב קעור ""34 G34WQi ||| מסך מחשב גיימינג קעור 34 שיאומי Xiaomi Curved Gaming Monitor G34WQi ||| מסך מחשב XIAOMI CURVED GAMING MONITOR G34WQi ||| Gaming Monitor G34WQi UWQHD מסך מחשב Xiaomi Curved ||| מסך מחשב Xiaomi Curved Gaming Monitor G34WQi","956.0, 1024.0, 1049.0",18,0.98,מסכי מחשב
12,מסך מחשב  ‏34 ‏אינטש Samsung C34G55TWWP SAML34550 UWQHD,1220.0,מסך מחשב  ‏34 ‏אינטש Samsung C34G55TWWP SAML34550 UWQHD ||| השוואה ב-14 חנויות ||| השוואת מחירים ||| מסך מחשב גיימינג קעור Samsung C34G55TWWP 34'' WQHD ||| קנו עכשיו ||| מסך מחשב 34 אינטש SAML34550 UWQHD Samsung ||| Samsung C34G55TWWP מסך מחשב בצבע שחור 34 אינטש ||| Samsung C34G55TWWP SAML34550 UWQHD מסך מחשב ‏34 ‏אינטש ||| מסך מחשב  ‏34 ‏אינטש Samsung C34G55TWWP,"1220.0, 1298.0, 1395.0, 1502.0, 1535.0",9,0.98,מסכי מחשב
35,מסך מחשב 27 אינטש Lenovo ThinkVision T27hv-30 63D6UAT3IS QHD יבואן רשמי,1227.0,מסך מחשב  ‏27 ‏אינטש Lenovo ThinkVision T27hv-30 63D6UAT3IS QHD ||| השוואה ב-17 חנויות ||| השוואת מחירים ||| מסך מחשב 27 אינטש Lenovo ThinkVision T27hv-30 63D6UAT3IS QHD יבואן רשמי ||| Lenovo ThinkVision T27hv-30 27 אינטש מסך מחשב QHD צבע שחור ||| Lenovo ThinkVision T27hv-30 63D6UAT3IS QHD מסך מחשב ‏27 ‏אינטש,"1227.0, 1366.0, 1439.0, 1496.0",6,0.98,מסכי מחשב
46,מסך מחשב גיימינג קעור Dell Alienware AW3425DWM 34 WQHD,1271.0,מסך מחשב גיימינג קעור Dell Alienware AW3425DWM 34 WQHD ||| קנו עכשיו ||| מסך גיימינג קעור Dell Alienware 34 WQHD AW3425DWM ||| Dell Alienware 34 WQHD AW3425DWM מסך גיימינג קעור ||| Dell Alienware AW3425DWM 34 WQHD מסך מחשב גיימינג קעור ||| מסך מחשב גיימינג קעור Dell Alienware  34 WQHD,"1271.0, 1397.0, 1458.0, 1536.0, 1733.0",6,0.98,מסכי מחשב
16,Samsung Odyssey G6 מסך מחשב 27 אינטש QHD S27BG650EM - יבואן רשמי,1666.0,מסך מחשב  ‏27 ‏אינטש Samsung Odyssey G6 S27BG650EM QHD ||| קנו עכשיו ||| מסך מחשב  ‏27 ‏אינטש Samsung Odyssey G6 S27BG650EM QHD ||| השוואה ב-17 חנויות ||| השוואת מחירים ||| Samsung Odyssey G6 מסך מחשב 27 אינטש QHD S27BG650EM - יבואן רשמי ||| מסך מחשב QHD 27 אינטש Samsung Odyssey G6 S27BG650EM - משלוח חינם ||| Samsung Odyssey G6 S27BG650EM QHD מסך מחשב ‏27 ‏אינטש,"1666.0, 1697.0, 1782.0, 1918.0",8,0.98,מסכי מחשב
9,מסך גיימינג Alienware Dell AW2725D 26.7 QHD - יבואן רשמי,1845.0,מסך מחשב גיימינג Dell Alienware AW2725Q 26.7 4K UHD ||| קנו עכשיו ||| מסך מחשב גיימינג Dell Alienware AW2725D 26.7 QHD ||| קנו עכשיו ||| מסך גיימינג Dell Alienware 4K UHD AW2725Q 26.7 ||| Dell Alienware 4K UHD מסך גיימינג 26.7 AW2725Q ||| Alienware AW2725Q 26.7 4K UHD מסך מחשב גיימינג Dell ||| מסך מחשב גיימינג Dell Alienware  26.7 4K UHD ||| Dell Alienware AW2725D מסך גיימינג 26.7 QHD - צבע שחור ||| מסך גיימינג Alienware Dell AW2725D 26.7 QHD - יבואן רשמי ||| Alienware AW2725D 26.7 QHD מסך מחשב גיימינג Dell ||| מסך מחשב גיימינג Dell Alienware  26.7 QHD,"1845.0, 2000.0, 2071.0, 2132.0, 2163.0, 2586.0, 2614.0, 2958.0, 3518.0, 3656.0",12,0.65,מסכי מחשב
54,מסך מחשב קעור Dell UltraSharp U3425WE 34.14 WQHD,2962.0,מסך מחשב קעור Dell UltraSharp U3425WE 34.14 WQHD ||| קנו עכשיו ||| Dell UltraSharp 34 אינטש WQHD קעור - דגם U3425WE ||| מסך מחשב קעור Dell U3425WE 34.14 אינטש WQHD ||| UltraSharp U3425WE 34.14 WQHD מסך מחשב קעור Dell,"2962.0, 3144.0, 3178.0, 3468.0",5,0.98,מסכי מחשב
